id,sector,direction,headline,body
68,Crypto,Bullish,Sovereign wealth fund discloses initial Bitcoin allocation in latest portfolio filing,A large sovereign wealth fund disclosed for the first time a position in Bitcoin in its public portfolio filing. The disclosure was widely interpreted as a significant institutional validation of digital assets as a legitimate portfolio allocation and triggered broad market enthusiasm.
69,Crypto,Bullish,DeFi protocol's total value locked surpasses prior cycle peak after governance overhaul,A leading decentralized finance protocol saw its total value locked surpass its previous all-time high following a comprehensive governance restructuring and fee mechanism upgrade. Analyst coverage was initiated by several digital asset research firms with bullish price targets.
70,Crypto,Bullish,G7 nations reach preliminary agreement on harmonized crypto regulatory framework,Finance ministers from G7 nations announced a preliminary agreement on a harmonized framework for regulating digital assets. The agreement reduces the risk of regulatory arbitrage and was welcomed by the crypto industry as providing the legal clarity needed for broader institutional participation.
71,Crypto,Bullish,Bitcoin halving event reduces new supply issuance; historically associated with multi-month bull runs,"Bitcoin completed its scheduled halving event, cutting the rate of new coin issuance in half. The event, which occurs approximately every four years, has historically preceded extended bull markets due to the reduction in selling pressure from miners and increased supply scarcity."
72,Crypto,Bullish,Smart contract platform announces partnership with top-three global bank for tokenized asset settlement,A leading smart contract blockchain announced a strategic partnership with one of the world's largest banks to develop a tokenized asset settlement infrastructure. The partnership was seen as a major step toward mainstream institutional use of public blockchain infrastructure.
73,Crypto,Bearish,Stablecoin issuer loses dollar peg after reserve transparency concerns trigger bank-run dynamic,A major stablecoin depegged from the US dollar after questions about the composition and liquidity of its reserves triggered a rapid redemption spiral. The event caused panic selling across the broader cryptocurrency market and reignited calls for urgent regulatory intervention.
74,Crypto,Bearish,"Regulatory agency classifies major proof-of-stake token as a security, exchange delistings follow","A financial regulatory agency issued a formal determination that a widely held proof-of-stake cryptocurrency token constitutes a security under existing law. Several major exchanges announced they would delist the token to avoid regulatory exposure, causing its price to plunge."
75,Crypto,Bearish,"Centralized crypto exchange discloses undisclosed related-party loans, triggers customer withdrawal wave","A prominent centralized cryptocurrency exchange disclosed that substantial customer assets had been lent to affiliated trading entities without customer consent. The revelation triggered a wave of customer withdrawals and forced the exchange to suspend redemptions, raising insolvency concerns."
76,Crypto,Bearish,Major DeFi protocol suffers exploit draining hundreds of millions from liquidity pools,"A top-ranked decentralized finance protocol was exploited through a previously undetected smart contract vulnerability, allowing an attacker to drain a significant amount of user funds from liquidity pools. The protocol suspended operations pending an audit, and its governance token price collapsed."
77,Crypto,Bearish,G20 nations coordinate ban on anonymous crypto wallet transactions above threshold,G20 nations announced coordinated regulations requiring identification for cryptocurrency wallet transactions above a de minimis threshold. The move was interpreted as a significant restriction on the pseudonymous nature of crypto and triggered broad market declines.
78,Crypto,Bearish,Bitcoin mining difficulty reaches record high as hashrate concentration raises centralization concerns,"Bitcoin mining difficulty surged to a new all-time high, leading analysts to flag that a small number of large mining pools now control a disproportionate share of total hashrate. The centralization concerns prompted discussion about long-term network security and censorship resistance."
79,Crypto,Bearish,"Crypto venture fund marks down portfolio by majority, signals sharp decline in startup funding activity","A leading cryptocurrency-focused venture fund disclosed a significant markdown in the fair value of its portfolio companies, citing deteriorating market conditions and dried-up exit opportunities. The fund announced it would slow the pace of new investments significantly."
80,Crypto,Bearish,"Nation-state level cyber attack targets cross-chain bridge, entire bridge TVL drained in hours","A cross-chain bridge protocol suffered a sophisticated cyber attack attributed to a nation-state threat actor, resulting in the complete drainage of assets locked in the bridge. The incident highlighted systemic risks in cross-chain infrastructure and caused widespread contagion across related ecosystems."
