id,sector,direction,headline,body
1,Tech,Bullish,"Leading cloud software firm reports record quarterly revenue, raises full-year guidance above analyst expectations","A major enterprise software company announced quarterly revenue growth that beat consensus estimates, citing strong demand for its AI-integrated SaaS platform. Management raised full-year guidance well above the Street's forecast and announced a new share buyback program."
2,Tech,Bullish,Semiconductor giant secures multi-year supply agreement with global automaker consortium,"A leading chipmaker signed a long-term supply deal with a consortium of major automakers to provide next-generation automotive chips. The agreement, spanning several years, is expected to add significant recurring revenue and reduce cyclical exposure for the company."
3,Tech,Bullish,"Dominant search and ad platform wins landmark antitrust appeal, shares surge in after-hours trading",A major internet advertising company successfully overturned a significant antitrust penalty on appeal. The ruling removes a major regulatory overhang and confirms the company's ability to maintain its core business model without structural changes.
4,Tech,Bullish,Consumer electronics leader launches AI-powered flagship device to record pre-order demand,"A prominent consumer technology company unveiled its latest flagship product line, which integrates proprietary on-device AI capabilities. Pre-orders surpassed any previous launch cycle by a wide margin, and several analysts immediately raised their price targets."
5,Tech,Bullish,Enterprise cybersecurity firm reports surge in government contract awards amid heightened threat environment,"A cybersecurity solutions provider announced a series of large federal contract wins, citing increased government spending on national infrastructure protection. Billings and remaining performance obligations both grew substantially year-over-year."
6,Tech,Bullish,Cloud hyperscaler's AI inference revenue surpasses prior-year total in just one quarter,A large cloud platform operator disclosed that revenue from AI inference workloads in the most recent quarter alone exceeded the entire prior fiscal year's AI revenue. Capacity utilization remained high and management guided for continued triple-digit growth.
7,Tech,Bullish,"Software platform company completes acquisition of leading data analytics firm, expands enterprise TAM","A diversified software company closed a major acquisition of a data analytics specialist, significantly expanding its total addressable market. Cross-sell opportunities are expected to accelerate revenue synergies starting in the next fiscal year."
8,Tech,Bullish,Global e-commerce and logistics firm achieves same-day delivery milestone across major metropolitan markets,"A large online retail and logistics company announced it has achieved same-day delivery capability in every major metro area in its core market, a milestone reached ahead of schedule. The logistics build-out is expected to drive margin improvement as fixed costs are leveraged."
9,Tech,Bearish,"Social media platform's daily active user growth stalls for third consecutive quarter, ad revenue misses",A major social media company reported flat user growth for the third straight quarter and advertising revenue that missed consensus estimates. Management cited increased competition for attention and advertiser budget shifts toward newer short-form video platforms.
10,Tech,Bearish,Semiconductor equipment maker warns of order cancellations as memory chipmakers cut capex,"A leading maker of chip manufacturing equipment issued a revenue warning after receiving significant order cancellations from memory chip producers, which are cutting capital expenditure amid a supply glut and falling DRAM and NAND prices."
11,Tech,Bearish,Software-as-a-service company faces customer churn spike as enterprise clients downsize IT budgets,A mid-market SaaS vendor reported a marked uptick in customer churn as enterprise clients renegotiated or cancelled subscriptions under cost-reduction mandates. Net revenue retention dropped below the threshold considered healthy by industry benchmarks.
12,Tech,Bearish,"Ride-hailing giant's autonomous vehicle program hit with fatal incident, regulatory scrutiny intensifies","A large ride-hailing platform disclosed a serious accident involving its autonomous vehicle test fleet. Regulators announced an immediate investigation and suspended the company's AV testing permits in two key markets, casting doubt on its long-term autonomous roadmap."
13,Tech,Bearish,PC and peripheral hardware maker issues profit warning as enterprise refresh cycle weakens,"A major personal computing hardware company slashed its quarterly earnings forecast, citing weaker-than-expected enterprise PC refresh demand and excess channel inventory. The company also announced layoffs to reduce its cost structure."
14,Tech,Bearish,Online gaming platform suffers massive data breach exposing tens of millions of user accounts,A popular online gaming and entertainment platform disclosed a large-scale data breach that compromised personal data of tens of millions of users. The company faces potential regulatory fines under data protection laws and a wave of class-action lawsuits.
15,Tech,Bearish,"Streaming video service reports net subscriber loss for second consecutive quarter, raises prices","A major streaming platform reported a net loss in subscribers for the second quarter in a row, missing estimates. The company simultaneously announced a price increase, which analysts warn could further accelerate churn in a saturated market."
16,Tech,Bearish,"Logistics tech startup misses IPO price target, trades down sharply on debut amid profitability concerns","A venture-backed logistics technology company priced its IPO below the targeted range and fell further in first-day trading. Investor concern centered on persistent operating losses, high customer acquisition costs, and an unclear path to profitability."
17,Energy,Bullish,"Major oil cartel announces deeper-than-expected production cuts, crude prices jump","A global oil-producing alliance voted to implement production cuts significantly larger than market participants had anticipated. Crude benchmark prices surged immediately following the announcement, and energy equities rallied across the board."
18,Energy,Bullish,"Integrated energy major reports highest free cash flow in company history, doubles dividend","A large integrated oil and gas company reported record free cash flow for the quarter, driven by elevated commodity prices and disciplined capital spending. The board approved a doubling of the quarterly dividend, signaling confidence in sustained cash generation."
19,Energy,Bullish,Offshore drilling contractor secures three-year deepwater contract at premium dayrates,"A leading offshore drilling company announced a three-year contract for a deepwater rig at dayrates well above the current market average, reflecting tight supply of high-specification rigs. Analysts noted the contract will significantly improve earnings visibility."
20,Energy,Bullish,"Natural gas utility reports record winter demand, raises capital investment plan for pipeline expansion","A major natural gas distribution utility reported peak winter demand that exceeded internal forecasts, driven by an extended cold snap across its service territory. Management announced an accelerated capital plan to expand pipeline capacity."
21,Energy,Bullish,Renewable energy developer wins largest offshore wind auction in the region's history,"A clean energy developer was awarded the rights to develop a massive offshore wind project following a competitive auction. The project represents the largest single offshore wind development in the region and is expected to generate predictable, long-term contracted cash flows."
22,Energy,Bullish,Midstream pipeline company raises distribution guidance after volume throughput beats expectations,A major midstream energy company reported pipeline throughput volumes that significantly beat analyst estimates and raised its full-year distribution guidance. Higher volumes were attributed to increased upstream activity in the company's core operating basins.
23,Energy,Bullish,Geopolitical supply disruption in key oil-producing region sends Brent crude to multi-month high,"Armed conflict in a significant oil-producing region disrupted export flows, sending Brent crude prices to their highest level in several months. Energy equity markets rallied broadly, with exploration and production companies leading the advance."
24,Energy,Bullish,"Battery storage company receives regulatory approval for grid-scale project pipeline, backlog triples",A utility-scale energy storage company received final regulatory approval for a series of large grid-scale battery projects. The approvals tripled the company's contracted project backlog and are expected to drive revenue growth for the next several years.
25,Energy,Bearish,Crude oil tumbles as non-OPEC supply surges and global demand growth forecasts are cut,Crude oil prices fell sharply after a major energy agency revised down its global demand growth forecast and data showed production in non-OPEC nations rising faster than expected. Exploration and production companies saw sharp equity declines.
26,Energy,Bearish,Major refiner warns of margin compression as crack spreads collapse to multi-year lows,A large petroleum refiner issued a profit warning after refining crack spreads fell to their lowest level in several years due to overcapacity and weaker-than-seasonal fuel demand. The company suspended its share repurchase program to preserve cash.
27,Energy,Bearish,Offshore wind developer cancels flagship project citing cost overruns and supply chain inflation,A major renewable energy developer announced the cancellation of a flagship offshore wind project after construction costs escalated far beyond original estimates due to supply chain disruptions and rising materials costs. The company took a significant impairment charge.
28,Energy,Bearish,Natural gas prices collapse as mild winter and record storage injections eliminate supply concerns,Natural gas benchmark prices fell to multi-year lows after an unusually mild winter left storage levels well above seasonal norms. Gas-weighted exploration and production companies saw their equity prices drop materially.
29,Energy,Bearish,Solar panel manufacturer reports severe margin pressure as Chinese competition floods domestic market,A domestic solar panel producer reported a dramatic compression in gross margins as a surge of low-cost imports undercut its pricing. The company warned that it may need to idle manufacturing capacity if trade conditions do not improve.
30,Energy,Bearish,Pipeline operator faces regulatory order to shut key interstate line pending safety inspection,A major pipeline company was ordered by regulators to take a key interstate pipeline offline for safety inspections following an incident. The shutdown is expected to materially reduce the company's throughput volumes and cash flow for the coming quarter.
31,Energy,Bearish,"Electric vehicle demand slowdown ripples through battery metals supply chain, lithium prices plunge","Weaker-than-expected electric vehicle sales prompted a reassessment of battery materials demand, sending lithium carbonate prices to multi-year lows. Mining companies with significant lithium exposure saw their equity prices decline substantially."
32,Energy,Bearish,Integrated energy company announces large write-down on oil sands asset amid long-term price uncertainty,"A major integrated oil producer recorded a significant impairment on its oil sands operations, citing downward revisions to long-term crude price assumptions and higher-than-expected operating costs. The write-down triggered a loss for the quarter."
33,Finance,Bullish,"Central bank signals pause in rate hike cycle, boosting bank net interest income outlook",The central bank held its benchmark rate steady and signaled through updated guidance that the tightening cycle was likely at or near its peak. Bank stocks rallied as investors recalibrated net interest income forecasts and reduced concerns about credit deterioration.
34,Finance,Bullish,Major investment bank reports record M&A advisory revenue as deal activity rebounds sharply,"A bulge-bracket investment bank reported its highest quarterly M&A advisory fee revenue on record, reflecting a strong rebound in corporate deal-making after a prolonged slowdown. The bank also raised its outlook for capital markets underwriting activity."
35,Finance,Bullish,Consumer credit quality improves as delinquency rates fall below pre-crisis levels at top card issuers,"Leading consumer credit card issuers reported credit card delinquency and charge-off rates that declined to below pre-recession levels. The improvement in credit quality allowed banks to release loan loss reserves, boosting reported earnings."
36,Finance,Bullish,"Insurance holding company benefits from favorable catastrophe loss season, beats earnings estimates",A major property and casualty insurance company reported better-than-expected quarterly earnings after a relatively benign hurricane and natural disaster season. Combined ratios improved materially year-over-year and premium rate increases remained strong.
37,Finance,Bullish,Asset management giant reports record AUM inflows as passive investing trend accelerates,"A leading asset management firm reported its highest-ever quarterly inflows into its passive index fund products. Total assets under management reached a new record high, driving fee revenue growth and positive operating leverage."
38,Finance,Bullish,"Payments network operator reports transaction volume growth acceleration, raises earnings guidance",A major payment network company reported accelerating cross-border transaction volumes and raised its full-year earnings per share guidance above consensus. Management cited continued recovery in international travel spending as a key growth driver.
39,Finance,Bullish,"Regional bank completes accretive acquisition, expands market share in high-growth Sun Belt region",A regional bank completed its acquisition of a rival institution in a high-growth demographic market. Analysts characterized the deal as highly accretive to earnings per share and noted the combined entity would rank among the top banks in its target geography.
40,Finance,Bullish,"Mortgage REIT benefits from steepening yield curve, raises quarterly dividend by double digits","A mortgage real estate investment trust reported improved net interest spreads as the yield curve steepened, boosting profitability. The board raised the quarterly dividend by a double-digit percentage, reflecting improved earnings power and book value stability."
41,Finance,Bearish,"Large regional bank discloses surprise commercial real estate losses, stock halted for trading","A major regional bank announced an unexpected and material increase in commercial real estate loan losses, triggering a trading halt in its shares. The bank disclosed it was in discussions with regulators regarding its capital adequacy and reserved the right to cut its dividend."
42,Finance,Bearish,"Central bank delivers surprise rate hike, inverting yield curve further and pressuring bank margins","In a move that caught markets off guard, the central bank raised its benchmark interest rate, deepening the inversion of the yield curve. Bank stocks fell sharply as the rate environment indicated tighter lending margins and higher near-term recession risk."
43,Finance,Bearish,Consumer finance company reports sharp rise in subprime auto loan delinquencies,A specialized consumer finance company reported a significant quarter-over-quarter increase in delinquency rates on its subprime auto loan portfolio. Management raised its provision for credit losses and acknowledged that macroeconomic headwinds were materializing faster than expected.
44,Finance,Bearish,Private equity firm suspends new fund raises after flagship fund performance disappoints LPs,A prominent private equity firm indefinitely postponed fundraising for its next flagship fund after limited partners expressed dissatisfaction with below-benchmark returns in existing vehicles. Several anchor investors reportedly declined to re-up for the new fund.
45,Finance,Bearish,Insurance giant faces multi-billion dollar liability exposure from emerging environmental litigation wave,"A large insurance and reinsurance company disclosed a review of potential exposure to an emerging wave of environmental litigation. Analysts estimated the range of potential liability could be material relative to the company's existing reserves, triggering a sell-off."
46,Finance,Bearish,Retail brokerage platform reports trading volume collapse as market volatility subsides,"A consumer-facing brokerage company reported a sharp drop in trading volumes and commission-equivalent revenue as market volatility declined to multi-year lows. Active user counts also fell sequentially, raising concerns about the sustainability of the pandemic-era growth surge."
47,Finance,Bearish,Fintech lender's securitization program faces investor pushback over loan performance deterioration,A technology-enabled consumer lender found diminishing investor appetite for its asset-backed securities after loan performance metrics in earlier vintages showed higher-than-projected default rates. The company warned that constrained securitization access would limit its origination volume.
48,Finance,Bearish,Major bank faces regulatory enforcement action over anti-money laundering compliance failures,A large commercial bank received a formal enforcement action from its primary regulator following an examination that found significant deficiencies in its anti-money laundering program. The action restricts the bank's ability to onboard new high-risk clients and may result in substantial fines.
49,Healthcare,Bullish,Biotech firm's Phase 3 trial for rare disease therapy shows statistically significant efficacy,"A clinical-stage biotechnology company announced that its Phase 3 pivotal trial for a rare genetic disease met its primary endpoint with statistical significance. Management indicated it plans to file for regulatory approval within the quarter, and analysts viewed the data as highly likely to support approval."
50,Healthcare,Bullish,"Pharmaceutical giant's blockbuster drug receives expanded label indication, adding large new patient population",A major pharmaceutical company received regulatory approval to expand the label of its top-selling drug to include a new therapeutic indication with a large addressable patient population. Peak sales estimates for the drug were revised substantially higher by the analyst community.
51,Healthcare,Bullish,Medical device maker wins FDA approval for minimally invasive surgical robot system,A medical technology company received FDA clearance for its next-generation robotic surgical system. The system targets a large and underpenetrated surgical market and is expected to begin generating meaningful commercial revenue within two quarters of launch.
52,Healthcare,Bullish,"Managed care giant beats earnings estimates, raises full-year guidance on strong enrollment growth","A large managed care organization reported quarterly earnings that exceeded consensus estimates, driven by higher-than-expected enrollment in both commercial and government-sponsored health plans. The company raised its full-year earnings guidance meaningfully above prior expectations."
53,Healthcare,Bullish,"Gene therapy startup's lead program receives breakthrough therapy designation, expediting review timeline","A clinical-stage gene therapy company announced that its lead program received breakthrough therapy designation from the regulatory agency, which is expected to accelerate the review process and reduce time to potential approval. The designation was seen as a strong signal of clinical differentiation."
54,Healthcare,Bullish,Diagnostic testing company reports record volumes from new AI-assisted pathology platform rollout,"A clinical diagnostics company reported record test volumes following the broad commercial rollout of its AI-assisted pathology platform. The technology improves turnaround time and diagnostic accuracy, and the company reported strong early adoption among major hospital systems."
55,Healthcare,Bullish,Large pharma acquires late-stage oncology asset at significant premium to bolster pipeline,"A major pharmaceutical company announced the acquisition of a clinical-stage oncology company at a substantial premium to its trading price, citing the strategic value of the target's late-stage cancer therapy pipeline. Analysts viewed the deal as a positive signal for the acquirer's long-term revenue outlook."
56,Healthcare,Bullish,Hospital operator reports strong same-facility admissions growth and improved payer mix,A large for-profit hospital operator reported same-facility patient admissions growth that beat estimates and an improving payer mix as more commercially insured patients were treated. Operating margins expanded year-over-year and management reiterated its full-year earnings outlook.
57,Healthcare,Bearish,Late-stage clinical trial for anticipated blockbuster drug fails to meet primary endpoint,"A pharmaceutical company's closely watched Phase 3 trial for a highly anticipated drug candidate failed to demonstrate statistically significant improvement over placebo on the primary endpoint. The company announced it would discontinue the development program, erasing a significant portion of its market capitalization."
58,Healthcare,Bearish,FDA issues complete response letter for drug application citing manufacturing deficiencies,"A specialty pharmaceutical company received a complete response letter from the FDA declining to approve its new drug application due to deficiencies identified during a manufacturing inspection. The company must remediate the issues and refile, delaying potential approval by at least a year."
59,Healthcare,Bearish,Major PBM faces Congressional investigation over drug pricing practices and rebate transparency,A large pharmacy benefit manager was notified of a formal Congressional investigation into its drug pricing practices and the transparency of manufacturer rebate arrangements. The investigation creates material regulatory and reputational risk for the company and its health plan clients.
60,Healthcare,Bearish,Managed care company raises medical cost outlook after Medicaid redetermination drives higher acuity,A major managed care organization raised its medical cost ratio guidance after experiencing higher-than-expected medical claims costs. Management cited elevated acuity levels in newly enrolled Medicaid populations following government redetermination processes.
61,Healthcare,Bearish,Biotech firm's lead immunology drug shows inferior efficacy versus established competitor in head-to-head trial,"A biotechnology company disclosed results of a head-to-head clinical trial comparing its lead immunology drug to a market-leading competitor. The company's drug did not demonstrate superiority and showed a numerically lower response rate, significantly weakening its commercial positioning."
62,Healthcare,Bearish,"Hospital system reports surge in labor costs and contract nurse spending, cuts earnings outlook","A large nonprofit hospital system disclosed a significant increase in contract labor costs and travel nurse expenses, leading management to reduce its operating income outlook for the year. The cost pressures were attributed to a persistent nursing shortage in its core markets."
63,Healthcare,Bearish,Drug maker faces generic competition years ahead of schedule after patent challenge succeeds,"A pharmaceutical company lost a critical patent litigation case covering its best-selling drug, opening the door for generic competition well ahead of the originally anticipated exclusivity expiration date. Analysts sharply cut their revenue and earnings estimates for the company."
64,Healthcare,Bearish,"Medical device recall expands to global scale, company sets aside large liability reserve","A medical device manufacturer expanded a product recall to include units distributed in multiple international markets after additional safety concerns were identified. The company disclosed a material addition to its product liability reserve, and several class-action lawsuits were filed."
65,Crypto,Bullish,"Spot Bitcoin ETF receives regulatory approval, institutional capital inflows surge from day one","Regulators granted approval for the first spot Bitcoin exchange-traded fund, a watershed moment for institutional adoption. Assets under management in the new product exceeded forecasts within the first week of trading, signaling strong pent-up institutional demand."
66,Crypto,Bullish,Major global payment network announces native cryptocurrency settlement layer integration,"A leading international payment network announced integration of a cryptocurrency settlement layer, enabling real-time cross-border payments in digital assets for its member financial institutions. Adoption is expected to drive transaction volume on the underlying blockchain significantly."
67,Crypto,Bullish,"Layer-1 blockchain completes successful upgrade to proof-of-stake, energy use drops sharply","A major proof-of-work blockchain network successfully transitioned to a proof-of-stake consensus mechanism. The upgrade dramatically reduced the network's energy consumption and removed a key ESG objection cited by institutional investors, broadening its potential investor base."
